{
  "$schema": "../../schemas/provider-mappings.schema.json",
  "kind": "provider-mappings",
  "schemaVersion": 2,
  "status": "development",
  "season": 2026,
  "note": "INTERNAL ONLY. Every provider value below is an exact identifier already recorded in docs/technical/GridView_Provider_Evaluation.md section 8. Matching is byte-for-byte: no case folding, trimming, slugging, transliteration or similarity search is ever applied. Targets are read from the curated GridView registries and are never minted from a provider name. These values must never appear in a public API fixture, response, OpenAPI example or published snapshot. Dormant: no adapter consumes this registry yet.",
  "mappings": [
    {
      "source": "jolpica",
      "entity": "driver",
      "providerField": "driverId",
      "providerValue": "norris",
      "gridviewId": "lando-norris",
      "evidence": "GridView_Provider_Evaluation.md 8.4 - Jolpica driverId slug example; 8.5 identifies Norris as the compared race winner.",
      "note": "The Jolpica slug is a surname only. It is not derivable from the GridView ID by any rule, which is why the mapping is curated rather than computed."
    },
    {
      "source": "jolpica",
      "entity": "driver",
      "providerField": "driverId",
      "providerValue": "albon",
      "gridviewId": "alexander-albon",
      "evidence": "GridView_Provider_Evaluation.md 8.10 driver albon - Jolpica F1 (CC BY-NC-SA 4.0) https://api.jolpi.ca/ergast/f1/2026/drivers/?limit=100 at 2026-09-23T18:33:12Z, HTTP 200, 32 of 32, SHA-256 2af29a2ae8fe8d3c1f2774d708fa9f8594ff27be69e0b2ce70b1d0513a4f0743."
    },
    {
      "source": "jolpica",
      "entity": "driver",
      "providerField": "driverId",
      "providerValue": "alonso",
      "gridviewId": "fernando-alonso",
      "evidence": "GridView_Provider_Evaluation.md 8.10 driver alonso - Jolpica F1 (CC BY-NC-SA 4.0) https://api.jolpi.ca/ergast/f1/2026/drivers/?limit=100 at 2026-09-23T18:33:12Z, HTTP 200, 32 of 32, SHA-256 2af29a2ae8fe8d3c1f2774d708fa9f8594ff27be69e0b2ce70b1d0513a4f0743."
    },
    {
      "source": "jolpica",
      "entity": "driver",
      "providerField": "driverId",
      "providerValue": "antonelli",
      "gridviewId": "andrea-kimi-antonelli",
      "evidence": "GridView_Provider_Evaluation.md 8.10 driver antonelli - Jolpica F1 (CC BY-NC-SA 4.0) https://api.jolpi.ca/ergast/f1/2026/drivers/?limit=100 at 2026-09-23T18:33:12Z, HTTP 200, 32 of 32, SHA-256 2af29a2ae8fe8d3c1f2774d708fa9f8594ff27be69e0b2ce70b1d0513a4f0743.",
      "note": "Curator decision 2026-09-23: the canonical ID uses the provider-evidenced full given name Andrea Kimi. The OpenF1 driver_number 12 for the same competitor is not mapped by this record and stays acknowledged."
    },
    {
      "source": "jolpica",
      "entity": "driver",
      "providerField": "driverId",
      "providerValue": "paul_aron",
      "gridviewId": "paul-aron",
      "evidence": "GridView_Provider_Evaluation.md 8.10 driver paul_aron - Jolpica F1 (CC BY-NC-SA 4.0) https://api.jolpi.ca/ergast/f1/2026/drivers/?limit=100 at 2026-09-23T18:33:12Z, HTTP 200, 32 of 32, SHA-256 2af29a2ae8fe8d3c1f2774d708fa9f8594ff27be69e0b2ce70b1d0513a4f0743."
    },
    {
      "source": "jolpica",
      "entity": "driver",
      "providerField": "driverId",
      "providerValue": "bearman",
      "gridviewId": "oliver-bearman",
      "evidence": "GridView_Provider_Evaluation.md 8.10 driver bearman - Jolpica F1 (CC BY-NC-SA 4.0) https://api.jolpi.ca/ergast/f1/2026/drivers/?limit=100 at 2026-09-23T18:33:12Z, HTTP 200, 32 of 32, SHA-256 2af29a2ae8fe8d3c1f2774d708fa9f8594ff27be69e0b2ce70b1d0513a4f0743."
    },
    {
      "source": "jolpica",
      "entity": "driver",
      "providerField": "driverId",
      "providerValue": "dino_beganovic",
      "gridviewId": "dino-beganovic",
      "evidence": "GridView_Provider_Evaluation.md 8.10 driver dino_beganovic - Jolpica F1 (CC BY-NC-SA 4.0) https://api.jolpi.ca/ergast/f1/2026/drivers/?limit=100 at 2026-09-23T18:33:12Z, HTTP 200, 32 of 32, SHA-256 2af29a2ae8fe8d3c1f2774d708fa9f8594ff27be69e0b2ce70b1d0513a4f0743."
    },
    {
      "source": "jolpica",
      "entity": "driver",
      "providerField": "driverId",
      "providerValue": "bortoleto",
      "gridviewId": "gabriel-bortoleto",
      "evidence": "GridView_Provider_Evaluation.md 8.10 driver bortoleto - Jolpica F1 (CC BY-NC-SA 4.0) https://api.jolpi.ca/ergast/f1/2026/drivers/?limit=100 at 2026-09-23T18:33:12Z, HTTP 200, 32 of 32, SHA-256 2af29a2ae8fe8d3c1f2774d708fa9f8594ff27be69e0b2ce70b1d0513a4f0743."
    },
    {
      "source": "jolpica",
      "entity": "driver",
      "providerField": "driverId",
      "providerValue": "bottas",
      "gridviewId": "valtteri-bottas",
      "evidence": "GridView_Provider_Evaluation.md 8.10 driver bottas - Jolpica F1 (CC BY-NC-SA 4.0) https://api.jolpi.ca/ergast/f1/2026/drivers/?limit=100 at 2026-09-23T18:33:12Z, HTTP 200, 32 of 32, SHA-256 2af29a2ae8fe8d3c1f2774d708fa9f8594ff27be69e0b2ce70b1d0513a4f0743."
    },
    {
      "source": "jolpica",
      "entity": "driver",
      "providerField": "driverId",
      "providerValue": "luke_browning",
      "gridviewId": "luke-browning",
      "evidence": "GridView_Provider_Evaluation.md 8.10 driver luke_browning - Jolpica F1 (CC BY-NC-SA 4.0) https://api.jolpi.ca/ergast/f1/2026/drivers/?limit=100 at 2026-09-23T18:33:12Z, HTTP 200, 32 of 32, SHA-256 2af29a2ae8fe8d3c1f2774d708fa9f8594ff27be69e0b2ce70b1d0513a4f0743."
    },
    {
      "source": "jolpica",
      "entity": "driver",
      "providerField": "driverId",
      "providerValue": "colapinto",
      "gridviewId": "franco-colapinto",
      "evidence": "GridView_Provider_Evaluation.md 8.10 driver colapinto - Jolpica F1 (CC BY-NC-SA 4.0) https://api.jolpi.ca/ergast/f1/2026/drivers/?limit=100 at 2026-09-23T18:33:12Z, HTTP 200, 32 of 32, SHA-256 2af29a2ae8fe8d3c1f2774d708fa9f8594ff27be69e0b2ce70b1d0513a4f0743."
    },
    {
      "source": "jolpica",
      "entity": "driver",
      "providerField": "driverId",
      "providerValue": "jak_crawford",
      "gridviewId": "jak-crawford",
      "evidence": "GridView_Provider_Evaluation.md 8.10 driver jak_crawford - Jolpica F1 (CC BY-NC-SA 4.0) https://api.jolpi.ca/ergast/f1/2026/drivers/?limit=100 at 2026-09-23T18:33:12Z, HTTP 200, 32 of 32, SHA-256 2af29a2ae8fe8d3c1f2774d708fa9f8594ff27be69e0b2ce70b1d0513a4f0743."
    },
    {
      "source": "jolpica",
      "entity": "driver",
      "providerField": "driverId",
      "providerValue": "leonardo_fornaroli",
      "gridviewId": "leonardo-fornaroli",
      "evidence": "GridView_Provider_Evaluation.md 8.10 driver leonardo_fornaroli - Jolpica F1 (CC BY-NC-SA 4.0) https://api.jolpi.ca/ergast/f1/2026/drivers/?limit=100 at 2026-09-23T18:33:12Z, HTTP 200, 32 of 32, SHA-256 2af29a2ae8fe8d3c1f2774d708fa9f8594ff27be69e0b2ce70b1d0513a4f0743."
    },
    {
      "source": "jolpica",
      "entity": "driver",
      "providerField": "driverId",
      "providerValue": "gasly",
      "gridviewId": "pierre-gasly",
      "evidence": "GridView_Provider_Evaluation.md 8.10 driver gasly - Jolpica F1 (CC BY-NC-SA 4.0) https://api.jolpi.ca/ergast/f1/2026/drivers/?limit=100 at 2026-09-23T18:33:12Z, HTTP 200, 32 of 32, SHA-256 2af29a2ae8fe8d3c1f2774d708fa9f8594ff27be69e0b2ce70b1d0513a4f0743."
    },
    {
      "source": "jolpica",
      "entity": "driver",
      "providerField": "driverId",
      "providerValue": "hadjar",
      "gridviewId": "isack-hadjar",
      "evidence": "GridView_Provider_Evaluation.md 8.10 driver hadjar - Jolpica F1 (CC BY-NC-SA 4.0) https://api.jolpi.ca/ergast/f1/2026/drivers/?limit=100 at 2026-09-23T18:33:12Z, HTTP 200, 32 of 32, SHA-256 2af29a2ae8fe8d3c1f2774d708fa9f8594ff27be69e0b2ce70b1d0513a4f0743."
    },
    {
      "source": "jolpica",
      "entity": "driver",
      "providerField": "driverId",
      "providerValue": "hamilton",
      "gridviewId": "lewis-hamilton",
      "evidence": "GridView_Provider_Evaluation.md 8.10 driver hamilton - Jolpica F1 (CC BY-NC-SA 4.0) https://api.jolpi.ca/ergast/f1/2026/drivers/?limit=100 at 2026-09-23T18:33:12Z, HTTP 200, 32 of 32, SHA-256 2af29a2ae8fe8d3c1f2774d708fa9f8594ff27be69e0b2ce70b1d0513a4f0743."
    },
    {
      "source": "jolpica",
      "entity": "driver",
      "providerField": "driverId",
      "providerValue": "colton_herta",
      "gridviewId": "colton-herta",
      "evidence": "GridView_Provider_Evaluation.md 8.10 driver colton_herta - Jolpica F1 (CC BY-NC-SA 4.0) https://api.jolpi.ca/ergast/f1/2026/drivers/?limit=100 at 2026-09-23T18:33:12Z, HTTP 200, 32 of 32, SHA-256 2af29a2ae8fe8d3c1f2774d708fa9f8594ff27be69e0b2ce70b1d0513a4f0743."
    },
    {
      "source": "jolpica",
      "entity": "driver",
      "providerField": "driverId",
      "providerValue": "ryo_hirakawa",
      "gridviewId": "ryo-hirakawa",
      "evidence": "GridView_Provider_Evaluation.md 8.10 driver ryo_hirakawa - Jolpica F1 (CC BY-NC-SA 4.0) https://api.jolpi.ca/ergast/f1/2026/drivers/?limit=100 at 2026-09-23T18:33:12Z, HTTP 200, 32 of 32, SHA-256 2af29a2ae8fe8d3c1f2774d708fa9f8594ff27be69e0b2ce70b1d0513a4f0743."
    },
    {
      "source": "jolpica",
      "entity": "driver",
      "providerField": "driverId",
      "providerValue": "hulkenberg",
      "gridviewId": "nico-hulkenberg",
      "evidence": "GridView_Provider_Evaluation.md 8.10 driver hulkenberg - Jolpica F1 (CC BY-NC-SA 4.0) https://api.jolpi.ca/ergast/f1/2026/drivers/?limit=100 at 2026-09-23T18:33:12Z, HTTP 200, 32 of 32, SHA-256 2af29a2ae8fe8d3c1f2774d708fa9f8594ff27be69e0b2ce70b1d0513a4f0743."
    },
    {
      "source": "jolpica",
      "entity": "driver",
      "providerField": "driverId",
      "providerValue": "ayumu_iwasa",
      "gridviewId": "ayumu-iwasa",